{"chain":{"chain_id":"chain-1","sequence_number":1},"evidence_refs":[{"digest":"sha256:aaaaaaaaaaaaaaaaaaaaaaaaaaaaaaaaaaaaaaaaaaaaaaaaaaaaaaaaaaaaaaaa","kind":"measurement","media_type":"application/json","signature_status":"Verified","uri":"artifact://usage"}],"issued_at":"2026-08-23T12:00:00Z","lineage":{"capabilities":[{"capability_id":"capability://leanctx/context","capability_version":"1.0.0","invocation_ref":"sha256:cccccccccccccccccccccccccccccccccccccccccccccccccccccccccccccccc"}],"identity_ref":"sha256:aaaaaaaaaaaaaaaaaaaaaaaaaaaaaaaaaaaaaaaaaaaaaaaaaaaaaaaaaaaaaaaa","invocation_id":"invocation-1","invocation_ref":"sha256:cccccccccccccccccccccccccccccccccccccccccccccccccccccccccccccccc","plan_id":"plan-1","plan_ref":"sha256:bbbbbbbbbbbbbbbbbbbbbbbbbbbbbbbbbbbbbbbbbbbbbbbbbbbbbbbbbbbbbbbb","policy_refs":["sha256:bbbbbbbbbbbbbbbbbbbbbbbbbbbbbbbbbbbbbbbbbbbbbbbbbbbbbbbbbbbbbbbb"],"task_id":"tâsk-✓","task_ref":"sha256:aaaaaaaaaaaaaaaaaaaaaaaaaaaaaaaaaaaaaaaaaaaaaaaaaaaaaaaaaaaaaaaa"},"outcome":{"state":"unknown"},"receipt_id":"sha256:9f7fd296fa564e250e6410bf4f8ff5a8209146680eec9d5a62a28f0b2bd05db5","schema_version":1,"signature":"AAAAAAAAAAAAAAAAAAAAAAAAAAAAAAAAAAAAAAAAAAAAAAAAAAAAAAAAAAAAAAAAAAAAAAAAAAAAAAAAAAAAAA==","signer":{"algorithm":"ed25519","key_admission":"external_trust_store","key_id":"test-key"},"status":"succeeded","values":[{"classification":"measured","evidence_digests":["sha256:aaaaaaaaaaaaaaaaaaaaaaaaaaaaaaaaaaaaaaaaaaaaaaaaaaaaaaaaaaaaaaaa"],"name":"input_tokens","unit":"token","value":42}]}
