{"chain":{"chain_id":"chain-treatment","sequence_number":1},"evidence_refs":[{"digest":"sha256:3727e51ab3589bc71c1692738468d2cce5b64c081d305d3773d237d38d5011ba","kind":"measurement","media_type":"application/json","signature_status":"Verified","uri":"artifact://treatment/measurement"}],"issued_at":"2026-08-22T09:00:00Z","lineage":{"capabilities":[{"capability_id":"capability://leanctx/context","capability_version":"1.0.0","invocation_ref":"sha256:ebb4eb1827bf3642287f790f76c8aa8ee3dab9c529b14876314cbf4dc529ddfb"}],"identity_ref":"sha256:f4bac08cc4ca329f3794c7028825da7725d1c937e59274cb062bb1a750997ba9","invocation_id":"invocation-treatment","invocation_ref":"sha256:ebb4eb1827bf3642287f790f76c8aa8ee3dab9c529b14876314cbf4dc529ddfb","plan_id":"plan-treatment","plan_ref":"sha256:d0dc5bf0ec2dde319957a0d893265b274f86d151930216a83e7173668db3e3a4","policy_refs":["sha256:ad93c7e4b8984e78029f85871fb74f464b8d67a2b3b8524c776652d65878a1a9"],"task_id":"task-treatment","task_ref":"sha256:2458907b034c9ca4a5bd65abc9a312910a629a85d8a642933d7ef5439a08a7bb"},"outcome":{"state":"unknown"},"receipt_id":"sha256:d4141aa9997522d2e1e6b7c3f884f2273ce224087925496ae1abb1b4eb475125","schema_version":1,"signature":"zcYL9zFXbZ6DkYDqBi8mBiB/bGiSDBEIUgf+B2cG6o27HLp27oCR5RMW17CmCZe0dpfqM5aH3rRmYMH6EE7iAg==","signer":{"algorithm":"ed25519","key_admission":"external_trust_store","key_id":"id:sha256:10ba682c8ad13513971e8b56881aab8bd702bb807796eca81932c735a94d6e6d"},"status":"succeeded","values":[{"classification":"measured","evidence_digests":["sha256:3727e51ab3589bc71c1692738468d2cce5b64c081d305d3773d237d38d5011ba"],"name":"input_tokens","unit":"token","value":42}]}