{"chain":{"chain_id":"chain-control","sequence_number":1},"evidence_refs":[{"digest":"sha256:3727e51ab3589bc71c1692738468d2cce5b64c081d305d3773d237d38d5011ba","kind":"measurement","media_type":"application/json","signature_status":"Verified","uri":"artifact://control/measurement"}],"issued_at":"2026-08-22T09:00:00Z","lineage":{"capabilities":[{"capability_id":"capability://leanctx/context","capability_version":"1.0.0","invocation_ref":"sha256:574af9ee69a6374afab5103ae6df966361bf44a3bffb8920937dec1993395187"}],"identity_ref":"sha256:f4bac08cc4ca329f3794c7028825da7725d1c937e59274cb062bb1a750997ba9","invocation_id":"invocation-control","invocation_ref":"sha256:574af9ee69a6374afab5103ae6df966361bf44a3bffb8920937dec1993395187","plan_id":"plan-control","plan_ref":"sha256:8f7fac4f96fbab78dae12e0402ebef2eb2e0b4fd264071f1f560058137f9bc75","policy_refs":["sha256:ad93c7e4b8984e78029f85871fb74f464b8d67a2b3b8524c776652d65878a1a9"],"task_id":"task-control","task_ref":"sha256:cb4a8b0255117537b92c89df015a026f5f0fdb35194461bfabd7ef7a9586def8"},"outcome":{"state":"unknown"},"receipt_id":"sha256:1043ffc0630b9ec583978ba279d1799b181c9dad8de9faba21dd64428312dc68","schema_version":1,"signature":"GkPUV8pzCCdurTW0HpO8AlxOOWzrTkk1nJ4mFbNI1aCUkAwyps/KWCAZLVS19594LNbmGJil7b1G7QFbGE8bAA==","signer":{"algorithm":"ed25519","key_admission":"external_trust_store","key_id":"id:sha256:10ba682c8ad13513971e8b56881aab8bd702bb807796eca81932c735a94d6e6d"},"status":"succeeded","values":[{"classification":"measured","evidence_digests":["sha256:3727e51ab3589bc71c1692738468d2cce5b64c081d305d3773d237d38d5011ba"],"name":"input_tokens","unit":"token","value":42}]}